<?xml version="1.0"?>
<!DOCTYPE Report
[
<!ELEMENT Report (General ,(Doc|BPT)) >
<!ATTLIST Report ver CDATA #REQUIRED tmZone CDATA #REQUIRED>

<!ELEMENT General ( DocLocation ) >
<!ATTLIST General productName CDATA #REQUIRED productVer CDATA #REQUIRED os CDATA #REQUIRED host CDATA #REQUIRED qcserver CDATA #IMPLIED qcproject CDATA #IMPLIED SolManSolutionId CDATA #IMPLIED SolManProjectId CDATA #IMPLIED SolManTestPlanId CDATA #IMPLIED SolManTestPackageId CDATA #IMPLIED SolManUserInfoData CDATA #IMPLIED  >

<!ELEMENT BPT (DName,Res,DVer?,TSet?,TInst?,NodeArgs,AdditionalInfo*,Doc*) >
<!ATTLIST BPT rID ID #REQUIRED >

<!ELEMENT Doc (DName,ConfName?,Res,DVer?,TSet?,TInst?,RunType?,DT?,AdditionalInfo*,Step*,DIter*,Step*,Action*,Doc*,Summary?,TestMaintenanceSummary*,NodeArgs?) >
<!ATTLIST Doc rID ID #REQUIRED type (Test|BC|BPTWrapperTest|Flow|Group|Action) "Test" productName CDATA #REQUIRED BCIter CDATA #IMPLIED >

<!ELEMENT RunType ( #PCDATA )>
<!ATTLIST RunType fmStep (False|True) "False" batch (False|True) "False" upDesc (False|True) "False" upChk (False|True) "False" upAS (False|True) "False">

<!ELEMENT DName ( #PCDATA ) >

<!ELEMENT ConfName ( #PCDATA ) >

<!ELEMENT Res ( #PCDATA ) >

<!ELEMENT AdditionalInfo (AdditionalDataName,AdditionalDataValue ) >

<!ELEMENT AdditionalDataName ( #PCDATA ) >

<!ELEMENT AdditionalDataValue ( #PCDATA ) >

<!ELEMENT DVer ( #PCDATA ) >

<!ELEMENT TSet ( #PCDATA ) >

<!ELEMENT TInst ( #PCDATA ) >

<!ELEMENT DIter (Step*,Action+,Summary?,NodeArgs)>
<!ATTLIST DIter rID ID #REQUIRED iterID CDATA #REQUIRED>

<!ELEMENT DocLocation ( #PCDATA )>

<!ELEMENT Action (AName,AIter*,(Step|HtmlStep|Action)*, Summary,ActionMaintenanceSummary*, NodeArgs ) >
<!ATTLIST Action rID ID #REQUIRED>

<!ELEMENT AIter ((Step|HtmlStep|Action)*,DataMapping?, Summary?,NodeArgs) >
<!ATTLIST AIter rID ID #REQUIRED iterID CDATA #REQUIRED isCountable (False|True) "False" >

<!ELEMENT AName ( #PCDATA ) >

<!ELEMENT TestMaintenanceSummary (ActionMaintenanceSummary*) >
<!ATTLIST TestMaintenanceSummary ObjectsAdded CDATA #REQUIRED ObjectsUpdated CDATA #REQUIRED StepsUpdated CDATA #REQUIRED StepsComments CDATA #REQUIRED><!ELEMENT ActionMaintenanceSummary (ObjectChange* ) >
<!ATTLIST ActionMaintenanceSummary Action CDATA #REQUIRED Objects CDATA #REQUIRED Updated CDATA #REQUIRED LinesTotal CDATA #REQUIRED Added CDATA #REQUIRED LinesUpdated CDATA #REQUIRED>

<!ELEMENT ObjectChange  (Hierarchy, PropertyChangeList* ) >
<!ATTLIST ObjectChange Operation CDATA #IMPLIED OriginalRepository CDATA #IMPLIED>

<!ELEMENT PropertyChangeList (PropertyDef*) >

<!ELEMENT PropertyDef (OriginalValue, NewValue) >
<!ATTLIST PropertyDef PropName CDATA #REQUIRED OriginRegularExpression (True|False) "False" NewRegularExpression (True|False) "False" AddedProperty (True|False) "False" >

<!ELEMENT OriginalValue ( #PCDATA )>

<!ELEMENT NewValue ( #PCDATA )>

<!ELEMENT Hierarchy  (ObjectName, Hierarchy*) >
<!ATTLIST Hierarchy MicClass CDATA #REQUIRED>

<!ELEMENT ObjectName  ( #PCDATA ) >

<!ELEMENT Step (Obj,Details,Time,TimeTick* ,(Step|HtmlStep|Doc)*, DataMapping?, NodeArgs) >
<!ATTLIST Step rID ID #REQUIRED retval CDATA #IMPLIED>

<!ELEMENT HtmlStep (HTML,TimeTick*,(Step|HtmlStep|Doc)*,NodeArgs) >
<!ATTLIST HtmlStep rID ID #REQUIRED >

<!ELEMENT Obj ( #PCDATA ) >
<!ATTLIST Obj plainTxt (False|True) "True">

<!ELEMENT Details ( #PCDATA ) >
<!ATTLIST Details plainTxt (False|True) "True">

<!ELEMENT Time ( #PCDATA ) >

<!ELEMENT HTML ( #PCDATA ) >

<!ELEMENT Disp ( #PCDATA ) >

<!ELEMENT TimeTick ( #PCDATA ) >

<!ELEMENT DataMapping ( DataMappedItem* )>
<!ELEMENT DataMappedItem EMPTY >
<!ATTLIST DataMappedItem dsName CDATA #REQUIRED >
<!ATTLIST DataMappedItem rowId CDATA #REQUIRED >

<!ELEMENT NodeArgs (Disp,TopPane?,BtmPane?,ExtendedInfo? )>
<!ATTLIST NodeArgs eType CDATA #REQUIRED icon CDATA #REQUIRED nRep CDATA #REQUIRED UserNote CDATA #IMPLIED filter (False|True) "True">
<!ATTLIST NodeArgs status (Passed|Failed|Done|Warning|Information) "Done">
<!ATTLIST NodeArgs iconSel CDATA #IMPLIED nType CDATA #IMPLIED MovieMarker CDATA "">
<!ATTLIST NodeArgs Source CDATA #IMPLIED SourceLine CDATA #IMPLIED StepFlowItemKey CDATA #IMPLIED >

<!ELEMENT TopPane (Path)>

<!ELEMENT BtmPane ( (Path|WR)?,ASHilite?)>
<!ATTLIST BtmPane vType CDATA "HTML">

<!ELEMENT Path ( #PCDATA ) >

<!ELEMENT ASHilite ( #PCDATA ) >

<!ELEMENT WR ( #PCDATA ) >

<!ELEMENT ExtendedInfo ( StepData ) >

<!ATTLIST ExtendedInfo StepType CDATA #REQUIRED>
<!ELEMENT DT (NodeArgs) >
<!ATTLIST DT rID ID #REQUIRED>

<!ELEMENT Summary (Param*)>
<!ATTLIST Summary sTime CDATA #IMPLIED eTime CDATA #IMPLIED passed CDATA #IMPLIED failed CDATA #IMPLIED warnings CDATA #IMPLIED retval CDATA #IMPLIED stopped (False|True) "False" >

<!ELEMENT Param (ParamName,ParamVal)+ >
<!ATTLIST Param paramInOut (In|Out) "In">

<!ELEMENT ParamName ( #PCDATA ) >

<!ELEMENT ParamVal ( #PCDATA ) >

]
>
<Report ver="2.0" tmZone="India Standard Time">
<General productName="HPE Unified Functional Testing" productVer="14.03" os="" host="WINDOWS-UNR7VLH"><DocLocation><![CDATA[C:\Hybrid Framework\Driver\Driver]]></DocLocation></General>
<Doc rID="T1"   productName= "HPE Unified Functional Testing"  >
<DName><![CDATA[Driver]]></DName>
<Res><![CDATA[Res9]]></Res>
<DT rID="T2">
<NodeArgs eType="Table" icon="2" nRep="4" filter="False" >
<Disp><![CDATA[Run-Time Data Table]]></Disp>
<BtmPane vType="Table" >
<Path><![CDATA[Default.xls]]></Path>
</BtmPane>
</NodeArgs>
</DT>
<DIter rID="T3" iterID="1" >
<Action rID="T4">
<AName><![CDATA[Action1]]></AName>
<Step rID="T5">
<Obj plainTxt="False" ><![CDATA[SystemUtil]]></Obj>
<Details plainTxt="False" ><![CDATA[SystemUtil]]></Details>
<Time><![CDATA[16-03-2023 - 16:42:01]]></Time>
<TimeTick>1678965121</TimeTick>
<Step rID="T6">
<Obj plainTxt="False" ><![CDATA[Run "C:\Program Files (x86)\HPE\Unified Functional Testing\samples\Flights Application\FlightsGUI.exe",1]]></Obj>
<Details plainTxt="False" ><![CDATA[Run "C:\Program Files (x86)\HPE\Unified Functional Testing\samples\Flights Application\FlightsGUI.exe",1]]></Details>
<Time><![CDATA[16-03-2023 - 16:42:01]]></Time>
<TimeTick>1678965121</TimeTick>
<NodeArgs eType="Replay" icon="5" nRep="11" status="Passed" >
<Disp><![CDATA[Run "C:\Program Files (x86)\HPE\Unified Functional Testing\samples\Flights Application\FlightsGUI.exe",1]]></Disp>
</NodeArgs>
</Step>
<NodeArgs eType="Replay" icon="5" nRep="10" status="Passed" >
<Disp><![CDATA[SystemUtil]]></Disp>
</NodeArgs>
</Step>
<Step rID="T7">
<Obj plainTxt="False" ><![CDATA[HPE MyFlight Sample Applicatio]]></Obj>
<Details plainTxt="False" ><![CDATA[WpfWindow]]></Details>
<Time><![CDATA[16-03-2023 - 16:42:02]]></Time>
<TimeTick>1678965122</TimeTick>
<Step rID="T8">
<Obj plainTxt="False" ><![CDATA[HPE MyFlight Sample Applicatio.Exist]]></Obj>
<Details plainTxt="False" ><![CDATA["Object exists"]]></Details>
<Time><![CDATA[16-03-2023 - 16:42:02]]></Time>
<TimeTick>1678965122</TimeTick>
<NodeArgs eType="Replay" icon="6" nRep="13" >
<Disp><![CDATA[HPE MyFlight Sample Applicatio.Exist]]></Disp>
</NodeArgs>
</Step>
<NodeArgs eType="Context" icon="6" nRep="12" >
<Disp><![CDATA[HPE MyFlight Sample Applicatio]]></Disp>
</NodeArgs>
</Step>
<Step rID="T9">
<Obj ><![CDATA[Application Launch]]></Obj>
<Details ><![CDATA[Application launched successfully]]></Details>
<Time><![CDATA[16-03-2023 - 16:42:02]]></Time>
<TimeTick>1678965122</TimeTick>
<NodeArgs eType="User" icon="7" nRep="14" status="Passed" >
<Disp><![CDATA[Application Launch]]></Disp>
</NodeArgs>
</Step>
<Step rID="T10">
<Obj plainTxt="False" ><![CDATA[HPE MyFlight Sample Applicatio]]></Obj>
<Details plainTxt="False" ><![CDATA[WpfWindow]]></Details>
<Time><![CDATA[16-03-2023 - 16:42:02]]></Time>
<TimeTick>1678965122</TimeTick>
<Step rID="T11">
<Obj plainTxt="False" ><![CDATA[agentName.Set]]></Obj>
<Details plainTxt="False" ><![CDATA["uname"]]></Details>
<Time><![CDATA[16-03-2023 - 16:42:02]]></Time>
<TimeTick>1678965122</TimeTick>
<NodeArgs eType="Replay" icon="8" nRep="17" >
<Disp><![CDATA[agentName.Set]]></Disp>
</NodeArgs>
</Step>
<Step rID="T12">
<Obj plainTxt="False" ><![CDATA[password.Set]]></Obj>
<Details plainTxt="False" ><![CDATA["pword"]]></Details>
<Time><![CDATA[16-03-2023 - 16:42:03]]></Time>
<TimeTick>1678965123</TimeTick>
<NodeArgs eType="Replay" icon="8" nRep="19" >
<Disp><![CDATA[password.Set]]></Disp>
</NodeArgs>
</Step>
<Step rID="T13">
<Obj plainTxt="False" ><![CDATA[OK.Click]]></Obj>
<Details plainTxt="False" ><![CDATA[]]></Details>
<Time><![CDATA[16-03-2023 - 16:42:03]]></Time>
<TimeTick>1678965123</TimeTick>
<NodeArgs eType="Replay" icon="9" nRep="21" >
<Disp><![CDATA[OK.Click]]></Disp>
</NodeArgs>
</Step>
<Step rID="T14">
<Obj plainTxt="False" ><![CDATA[FIND FLIGHTS.Exist]]></Obj>
<Details plainTxt="False" ><![CDATA["Object does not exist"]]></Details>
<Time><![CDATA[16-03-2023 - 16:42:06]]></Time>
<TimeTick>1678965126</TimeTick>
<NodeArgs eType="Replay" icon="9" nRep="23" >
<Disp><![CDATA[FIND FLIGHTS.Exist]]></Disp>
</NodeArgs>
</Step>
<NodeArgs eType="Context" icon="6" nRep="16" >
<Disp><![CDATA[HPE MyFlight Sample Applicatio]]></Disp>
</NodeArgs>
</Step>
<Step rID="T15">
<Obj ><![CDATA[Login]]></Obj>
<Details ><![CDATA[Login unSuccessfull]]></Details>
<Time><![CDATA[16-03-2023 - 16:42:06]]></Time>
<TimeTick>1678965126</TimeTick>
<NodeArgs eType="User" icon="7" nRep="24" status="Failed" >
<Disp><![CDATA[Login]]></Disp>
</NodeArgs>
</Step>
<Step rID="T16">
<Obj plainTxt="False" ><![CDATA[HPE MyFlight Sample Applicatio]]></Obj>
<Details plainTxt="False" ><![CDATA[WpfWindow]]></Details>
<Time><![CDATA[16-03-2023 - 16:42:07]]></Time>
<TimeTick>1678965127</TimeTick>
<Step rID="T17">
<Obj plainTxt="False" ><![CDATA[HPE MyFlight Sample Applicatio.close]]></Obj>
<Details plainTxt="False" ><![CDATA[]]></Details>
<Time><![CDATA[16-03-2023 - 16:42:07]]></Time>
<TimeTick>1678965127</TimeTick>
<NodeArgs eType="Replay" icon="6" nRep="27" >
<Disp><![CDATA[HPE MyFlight Sample Applicatio.close]]></Disp>
</NodeArgs>
</Step>
<Step rID="T18">
<Obj plainTxt="False" ><![CDATA[HPE MyFlight Sample Applicatio.Exist]]></Obj>
<Details plainTxt="False" ><![CDATA["Object does not exist"]]></Details>
<Time><![CDATA[16-03-2023 - 16:42:09]]></Time>
<TimeTick>1678965129</TimeTick>
<NodeArgs eType="Replay" icon="6" nRep="29" >
<Disp><![CDATA[HPE MyFlight Sample Applicatio.Exist]]></Disp>
</NodeArgs>
</Step>
<NodeArgs eType="Context" icon="6" nRep="26" >
<Disp><![CDATA[HPE MyFlight Sample Applicatio]]></Disp>
</NodeArgs>
</Step>
<Step rID="T19">
<Obj ><![CDATA[close the application]]></Obj>
<Details ><![CDATA[application closed unsuccessfully]]></Details>
<Time><![CDATA[16-03-2023 - 16:42:09]]></Time>
<TimeTick>1678965129</TimeTick>
<NodeArgs eType="User" icon="7" nRep="30" status="Passed" >
<Disp><![CDATA[close the application]]></Disp>
</NodeArgs>
</Step>
<Step rID="T20">
<Obj plainTxt="False" ><![CDATA[SystemUtil]]></Obj>
<Details plainTxt="False" ><![CDATA[SystemUtil]]></Details>
<Time><![CDATA[16-03-2023 - 16:42:10]]></Time>
<TimeTick>1678965130</TimeTick>
<Step rID="T21">
<Obj plainTxt="False" ><![CDATA[Run "C:\Program Files (x86)\HPE\Unified Functional Testing\samples\Flights Application\FlightsGUI.exe",1]]></Obj>
<Details plainTxt="False" ><![CDATA[Run "C:\Program Files (x86)\HPE\Unified Functional Testing\samples\Flights Application\FlightsGUI.exe",1]]></Details>
<Time><![CDATA[16-03-2023 - 16:42:10]]></Time>
<TimeTick>1678965130</TimeTick>
<NodeArgs eType="Replay" icon="5" nRep="34" status="Passed" >
<Disp><![CDATA[Run "C:\Program Files (x86)\HPE\Unified Functional Testing\samples\Flights Application\FlightsGUI.exe",1]]></Disp>
</NodeArgs>
</Step>
<NodeArgs eType="Replay" icon="5" nRep="33" status="Passed" >
<Disp><![CDATA[SystemUtil]]></Disp>
</NodeArgs>
</Step>
<Step rID="T22">
<Obj plainTxt="False" ><![CDATA[HPE MyFlight Sample Applicatio]]></Obj>
<Details plainTxt="False" ><![CDATA[WpfWindow]]></Details>
<Time><![CDATA[16-03-2023 - 16:42:11]]></Time>
<TimeTick>1678965131</TimeTick>
<Step rID="T23">
<Obj plainTxt="False" ><![CDATA[HPE MyFlight Sample Applicatio.Exist]]></Obj>
<Details plainTxt="False" ><![CDATA["Object exists"]]></Details>
<Time><![CDATA[16-03-2023 - 16:42:11]]></Time>
<TimeTick>1678965131</TimeTick>
<NodeArgs eType="Replay" icon="6" nRep="36" >
<Disp><![CDATA[HPE MyFlight Sample Applicatio.Exist]]></Disp>
</NodeArgs>
</Step>
<NodeArgs eType="Context" icon="6" nRep="35" >
<Disp><![CDATA[HPE MyFlight Sample Applicatio]]></Disp>
</NodeArgs>
</Step>
<Step rID="T24">
<Obj ><![CDATA[Application Launch]]></Obj>
<Details ><![CDATA[Application launched successfully]]></Details>
<Time><![CDATA[16-03-2023 - 16:42:11]]></Time>
<TimeTick>1678965131</TimeTick>
<NodeArgs eType="User" icon="7" nRep="37" status="Passed" >
<Disp><![CDATA[Application Launch]]></Disp>
</NodeArgs>
</Step>
<Step rID="T25">
<Obj plainTxt="False" ><![CDATA[HPE MyFlight Sample Applicatio]]></Obj>
<Details plainTxt="False" ><![CDATA[WpfWindow]]></Details>
<Time><![CDATA[16-03-2023 - 16:42:12]]></Time>
<TimeTick>1678965132</TimeTick>
<Step rID="T26">
<Obj plainTxt="False" ><![CDATA[agentName.Set]]></Obj>
<Details plainTxt="False" ><![CDATA["uname"]]></Details>
<Time><![CDATA[16-03-2023 - 16:42:12]]></Time>
<TimeTick>1678965132</TimeTick>
<NodeArgs eType="Replay" icon="8" nRep="40" >
<Disp><![CDATA[agentName.Set]]></Disp>
</NodeArgs>
</Step>
<Step rID="T27">
<Obj plainTxt="False" ><![CDATA[password.Set]]></Obj>
<Details plainTxt="False" ><![CDATA["pword"]]></Details>
<Time><![CDATA[16-03-2023 - 16:42:12]]></Time>
<TimeTick>1678965132</TimeTick>
<NodeArgs eType="Replay" icon="8" nRep="42" >
<Disp><![CDATA[password.Set]]></Disp>
</NodeArgs>
</Step>
<Step rID="T28">
<Obj plainTxt="False" ><![CDATA[OK.Click]]></Obj>
<Details plainTxt="False" ><![CDATA[]]></Details>
<Time><![CDATA[16-03-2023 - 16:42:12]]></Time>
<TimeTick>1678965132</TimeTick>
<NodeArgs eType="Replay" icon="9" nRep="44" >
<Disp><![CDATA[OK.Click]]></Disp>
</NodeArgs>
</Step>
<Step rID="T29">
<Obj plainTxt="False" ><![CDATA[FIND FLIGHTS.Exist]]></Obj>
<Details plainTxt="False" ><![CDATA["Object does not exist"]]></Details>
<Time><![CDATA[16-03-2023 - 16:42:15]]></Time>
<TimeTick>1678965135</TimeTick>
<NodeArgs eType="Replay" icon="9" nRep="46" >
<Disp><![CDATA[FIND FLIGHTS.Exist]]></Disp>
</NodeArgs>
</Step>
<NodeArgs eType="Context" icon="6" nRep="39" >
<Disp><![CDATA[HPE MyFlight Sample Applicatio]]></Disp>
</NodeArgs>
</Step>
<Step rID="T30">
<Obj ><![CDATA[Login]]></Obj>
<Details ><![CDATA[Login unSuccessfull]]></Details>
<Time><![CDATA[16-03-2023 - 16:42:15]]></Time>
<TimeTick>1678965135</TimeTick>
<NodeArgs eType="User" icon="7" nRep="47" status="Failed" >
<Disp><![CDATA[Login]]></Disp>
</NodeArgs>
</Step>
<Step rID="T31">
<Obj plainTxt="False" ><![CDATA[HPE MyFlight Sample Applicatio]]></Obj>
<Details plainTxt="False" ><![CDATA[WpfWindow]]></Details>
<Time><![CDATA[16-03-2023 - 16:42:36]]></Time>
<TimeTick>1678965156</TimeTick>
<Step rID="T32">
<Obj plainTxt="False" ><![CDATA[fromCity]]></Obj>
<Details plainTxt="False" ><![CDATA[Cannot&nbsp;identify&nbsp;the&nbsp;object&nbsp;"fromCity"&nbsp;(of&nbsp;class&nbsp;WpfComboBox).<br/>Verify&nbsp;that&nbsp;this&nbsp;object's&nbsp;properties&nbsp;match&nbsp;an&nbsp;object&nbsp;currently&nbsp;displayed&nbsp;in&nbsp;your&nbsp;application.]]></Details>
<Time><![CDATA[16-03-2023 - 16:42:36]]></Time>
<TimeTick>1678965156</TimeTick>
<Step rID="T33">
<Obj plainTxt="False" ><![CDATA[fromCity]]></Obj>
<Details plainTxt="False" ><![CDATA[Object's physical description:<br>devname = fromCity<br>]]></Details>
<Time><![CDATA[16-03-2023 - 16:42:36]]></Time>
<TimeTick>1678965156</TimeTick>
<NodeArgs eType="Replay" icon="11" nRep="52" status="Warning" nType="Description" >
<Disp><![CDATA[fromCity]]></Disp>
</NodeArgs>
</Step>
<NodeArgs eType="Replay" icon="10" nRep="51" status="Failed" nType="Run Error" >
<Disp><![CDATA[fromCity]]></Disp>
</NodeArgs>
</Step>
<NodeArgs eType="Context" icon="6" nRep="50" status="Failed" >
<Disp><![CDATA[HPE MyFlight Sample Applicatio]]></Disp>
</NodeArgs>
</Step>
<Step rID="T34">
<Obj plainTxt="False" ><![CDATA[HPE MyFlight Sample Applicatio]]></Obj>
<Details plainTxt="False" ><![CDATA[WpfWindow]]></Details>
<Time><![CDATA[16-03-2023 - 16:42:36]]></Time>
<TimeTick>1678965156</TimeTick>
<Step rID="T35">
<Obj plainTxt="False" ><![CDATA[Run Error]]></Obj>
<Details plainTxt="False" ><![CDATA[Cannot identify the object &quot;fromCity&quot; (of class WpfComboBox).<BR/>Verify that this object's properties match an object currently displayed in your application.<BR/>Function file: C:\Hybrid Framework\Functional Library\library 1 flight.qfl<BR/>Line (42): &quot;	WpfWindow(&quot;HPE MyFlight Sample Applicatio&quot;).WpfComboBox(&quot;fromCity&quot;).Select &quot;Denver&quot;&quot;.]]></Details>
<Time><![CDATA[16-03-2023 - 16:42:37]]></Time>
<TimeTick>1678965157</TimeTick>
<NodeArgs eType="Replay" icon="11" nRep="54" status="Failed" Source="C:\Hybrid Framework\Functional Library\library 1 flight.qfl" SourceLine="41" >
<Disp><![CDATA[Run Error]]></Disp>
<BtmPane vType="ViewerGen.SSViewerGen" >
<Path><![CDATA[ZIP::Act1\Row0\ssf2.xml]]></Path>
<ASHilite><![CDATA[1639250]]></ASHilite>
</BtmPane>
</NodeArgs>
</Step>
<Step rID="T36">
<Obj plainTxt="False" ><![CDATA[Stop Run]]></Obj>
<Details plainTxt="False" ><![CDATA[Run stopped by user.]]></Details>
<Time><![CDATA[16-03-2023 - 16:43:57]]></Time>
<TimeTick>1678965237</TimeTick>
<NodeArgs eType="General" icon="12" nRep="55" status="Information" >
<Disp><![CDATA[Stop Run]]></Disp>
</NodeArgs>
</Step>
<NodeArgs eType="Context" icon="6" nRep="53" status="Failed" Source="C:\Hybrid Framework\Functional Library\library 1 flight.qfl" SourceLine="-1" >
<Disp><![CDATA[HPE MyFlight Sample Applicatio]]></Disp>
<BtmPane vType="ViewerGen.SSViewerGen" >
<Path><![CDATA[ZIP::Act1\Row0\ssf1.xml]]></Path>
<ASHilite><![CDATA[1639250]]></ASHilite>
</BtmPane>
</NodeArgs>
</Step>
<Summary sTime="16-03-2023 - 16:42:00" eTime="16-03-2023 - 16:43:57" passed="5" failed="4" warnings="1" ></Summary>
<NodeArgs eType="StartAction" icon="4" nRep="7" status="Failed" >
<Disp><![CDATA[Action1 Summary]]></Disp>
</NodeArgs>
</Action>
<NodeArgs eType="StartIteration" icon="3" nRep="6" status="Failed" >
<Disp><![CDATA[Driver Iteration 1 (Row 1)]]></Disp>
</NodeArgs>
</DIter>
<Summary sTime="16-03-2023 - 16:41:58" eTime="16-03-2023 - 16:43:57" passed="5" failed="4" warnings="1" ></Summary>
<NodeArgs eType="StartTest" icon="1" nRep="3" status="Failed" >
<Disp><![CDATA[Test Driver Summary]]></Disp>
</NodeArgs>
</Doc>
</Report>